GB0030927700_9760;M&G SECU/EUROPEAN SUST GBP;United Kingdom;0.0;0.0;0.0;0.0;0.0;0.0;0.0;0.0
GB0030927817_9760;M&G SECU/EUROPEAN SUST GBP;United Kingdom;0.0;0.0;0.0;0.0;0.0;0.0;0.0;0.0
GB0030932346_9760;M&G SECU/GLOBAL THEMES GBP;United Kingdom;0.0;0.0;0.0;0.0;0.0;0.0;0.0;0.0
GB0030932452_697;M&G SECU/GLOBAL THEMES GBP;United Kingdom;0.0;0.0;0.0;0.0;0.0;0.0;0.0;0.0
GB0030932676_205;M&G SECU/GLOBAL BASICS EUR EUR;United Kingdom;0.0;0.0;0.0;0.0;0.0;0.0;0.0;0.0
GB0030932783_205;M&G SECU/GLOBAL BASICS EUR;United Kingdom;0.0;0.0;0.0;0.0;0.0;0.0;0.0;0.0
GB0030937840_697;M&G SECU/GLOBAL SUSTAI GBP;United Kingdom;0.0;0.0;0.0;0.0;0.0;0.0;0.0;0.0
GB0030938038_3313;M&G SECU/GLOBAL SUSTAI GBP;United Kingdom;0.0;0.0;0.0;0.0;0.0;0.0;0.0;0.0
GB0030938368_3232;M&G SECU/JAPAN STERLIN GBP;United Kingdom;0.0;0.0;0.0;0.0;0.0;0.0;0.0;0.0
GB0030938475_2914;M&G SECU/JAPAN STERLIN GBP;United Kingdom;0.0;0.0;0.0;0.0;0.0;0.0;0.0;0.0
GB0030939440_9760;M&G SECU/ASIAN GBP A'I GBP;United Kingdom;0.0;0.0;0.0;0.0;0.0;0.0;0.0;0.0
GB0030939556_3313;M&G SECU/ASIAN GBP A'A GBP;United Kingdom;0.0;0.0;0.0;0.0;0.0;0.0;0.0;0.0
GB0031107021_697;M&G SECU/EXTRA INCOME GBP;United Kingdom;0.0;0.0;0.0;0.0;0.0;0.0;0.0;0.0
GB0031107468_3313;M&G SECU/EXTRA INCOME GBP;United Kingdom;0.0;0.0;0.0;0.0;0.0;0.0;0.0;0.0
GB0031107807_697;M&G SECU/GILT & FIXED GBP;United Kingdom;0.0;0.0;0.0;0.0;0.0;0.0;0.0;0.0
GB0031108433_3313;M&G SECU/GILT & FIXED GBP;United Kingdom;0.0;0.0;0.0;0.0;0.0;0.0;0.0;0.0
GB0031110397_697;M&G SECU/SHORT DATED C GBP;United Kingdom;0.0;0.0;0.0;0.0;0.0;0.0;0.0;0.0
GB0031110843_3313;M&G SECU/INDEX TRACKER GBP;United Kingdom;0.0;0.0;0.0;0.0;0.0;0.0;0.0;0.0
GB0031110959_3313;M&G SECU/INDEX TRACKER GBP;United Kingdom;0.0;0.0;0.0;0.0;0.0;0.0;0.0;0.0
GB0031111361_697;M&G SECU/INDEX LKD BON GBP;United Kingdom;0.0;0.0;0.0;0.0;0.0;0.0;0.0;0.0
GB0031111478_697;M&G SECU/INDEX LKD BON GBP;United Kingdom;0.0;0.0;0.0;0.0;0.0;0.0;0.0;0.0
GB0031111700_3232;M&G SECU/UK SLCT A IN GBP;United Kingdom;0.0;0.0;0.0;0.0;0.0;0.0;0.0;0.0
GB0031111817_3313;M&G SECU/UK SLCT A AC GBP;United Kingdom;0.0;0.0;0.0;0.0;0.0;0.0;0.0;0.0
GB0031285678_697;M&G SECU/CORPORATE BD GBP;United Kingdom;0.0;0.0;0.0;0.0;0.0;0.0;0.0;0.0
GB0031285785_3232;M&G SECU/CORPORATE BD GBP;United Kingdom;0.0;0.0;0.0;0.0;0.0;0.0;0.0;0.0
GB0031286080_3313;M&G SECU/DIVIDEND STER GBP;United Kingdom;0.0;0.0;0.0;0.0;0.0;0.0;0.0;0.0
GB0031286197_3313;M&G SECU/DIVIDEND STER GBP;United Kingdom;0.0;0.0;0.0;0.0;0.0;0.0;0.0;0.0
GB0031288912_9760;M&G SECU/INTERNATIONAL GBP;United Kingdom;0.0;0.0;0.0;0.0;0.0;0.0;0.0;0.0
GB0031289092_697;M&G SECU/INTERNATIONAL GBP;United Kingdom;0.0;0.0;0.0;0.0;0.0;0.0;0.0;0.0
GB0031289100_9760;M&G SECU/RECOVERY STER GBP;United Kingdom;0.0;0.0;0.0;0.0;0.0;0.0;0.0;0.0
GB0031289217_9760;M&G SECU/RECOVERY STER GBP;United Kingdom;0.0;0.0;0.0;0.0;0.0;0.0;0.0;0.0
GB0031289324_3313;M&G SECU/SMALL CO'S ST GBP;United Kingdom;0.0;0.0;0.0;0.0;0.0;0.0;0.0;0.0
GB0031289431_3313;M&G SECU/SMALL CO'S ST GBP;United Kingdom;0.0;0.0;0.0;0.0;0.0;0.0;0.0;0.0
GB0031616708_9760;M&G SECU/GLOBAL MACRO GBP;United Kingdom;0.0;0.0;0.0;0.0;0.0;0.0;0.0;0.0
GB0031616815_2914;M&G SECU/GLOBAL MACRO GBP;United Kingdom;0.0;0.0;0.0;0.0;0.0;0.0;0.0;0.0
GB0031957102_697;M&G SECU/INV '2'HIGH Y GBP;United Kingdom;0.0;0.0;0.0;0.0;0.0;0.0;0.0;0.0
GB0031957219_3232;M&G SECU/INV '2'HIGH Y GBP;United Kingdom;0.0;0.0;0.0;0.0;0.0;0.0;0.0;0.0
GB0031958621_3232;M&G SECU/INV '3'EMERGI GBP;United Kingdom;0.0;0.0;0.0;0.0;0.0;0.0;0.0;0.0
GB0031958738_697;M&G SECU/INV '3'EMERGI GBP;United Kingdom;0.0;0.0;0.0;0.0;0.0;0.0;0.0;0.0
GB0031960478_3313;M&G SECU/EPISODE GWTH GBP;United Kingdom;0.0;0.0;0.0;0.0;0.0;0.0;0.0;0.0
GB0031960585_697;M&G SECU/EPISODE GWTH GBP;United Kingdom;0.0;0.0;0.0;0.0;0.0;0.0;0.0;0.0
GB0031960692_3313;M&G SECU/MANAGED GWTH GBP;United Kingdom;0.0;0.0;0.0;0.0;0.0;0.0;0.0;0.0
GB0031960700_697;M&G SECU/MANAGED GWTH GBP;United Kingdom;0.0;0.0;0.0;0.0;0.0;0.0;0.0;0.0
GB0033521955_2605;BARG MANA/EASTERN TRUST USD;United Kingdom;0.0;0.0;0.0;0.2857142857142857;0.0;0.0;0.0;0.0
GG00B1YMBS31_3129;M&G GUER/OFFSHORE OPTI GBP;Guernsey;0.0;0.0;0.0;0.0;0.0;0.0;0.0;0.0
GG00B52MXV06_246;PARS GROU/I GBP GBP;Guernsey;0.0;0.0;1.0;0.09523809523809523;0.0;0.0;0.0;0.0
GG00B52VG522_246;PARS GROU/P EUR GBP;Guernsey;0.0;0.0;1.0;0.09523809523809523;0.0;0.0;0.0;0.0
GG00B57GCT81_246;PARS GROU/I CHF CHF;Guernsey;0.0;0.0;1.0;0.09523809523809523;0.0;0.0;0.0;0.0
GG00B58LGT06_246;PARS GROU/P CHF CHF;Guernsey;0.0;0.0;1.0;0.09523809523809523;0.0;0.0;0.0;0.0
GG00B5SNRY87_246;PARS GROU/I EUR EUR;Guernsey;0.0;0.0;1.0;0.09523809523809523;0.0;0.0;0.0;0.0
GG00B5TDGJ56_246;PARS GROU/P USD USD;Guernsey;0.0;0.0;1.0;0.09523809523809523;0.0;0.0;0.0;0.0
GG00B76V9426_3129;M&G GUER/OFFSHORE CORP GBP;Guernsey;0.0;0.0;0.0;0.0;0.0;0.0;0.0;0.0
GG00B76V9533_3129;M&G GUER/OFFSHORE OPTI GBP;Guernsey;0.0;0.0;0.0;0.0;0.0;0.0;0.0;0.0
GG00BFWK7H85_246;PARS GROU/PARTNERS N US N USD;Guernsey;0.0;0.0;1.0;0.09523809523809523;0.0;0.0;0.0;0.0
GG00BGGM0Y54_246;PARS GROU/PARTNERS E-N E-N CHF;Guernsey;0.0;0.0;1.0;0.09523809523809523;0.0;0.0;0.0;0.0
GG00BGGM1312_246;PARS GROU/PARTNERS E-N E-N EUR;Guernsey;0.0;0.0;1.0;0.09523809523809523;0.0;0.0;0.0;0.0
GG00BGGM1429_246;PARS GROU/PARTNERS E-N E-N GBP;Guernsey;0.0;0.0;1.0;0.09523809523809523;0.0;0.0;0.0;0.0
GG00BGGM1536_246;PARS GROU/PARTNERS E-N E-N USD;Guernsey;0.0;0.0;1.0;0.09523809523809523;0.0;0.0;0.0;0.0
GG00BGGM1643_246;PARS GROU/PARTNERS C-N C-N CHF;Guernsey;0.0;0.0;1.0;0.09523809523809523;0.0;0.0;0.0;0.0
GG00BGGM1759_246;PARS GROU/PARTNERS C-N C-N EUR;Guernsey;0.0;0.0;1.0;0.09523809523809523;0.0;0.0;0.0;0.0
GG00BGGM1866_246;PARS GROU/PARTNERS C-N C-N USD;Guernsey;0.0;0.0;1.0;0.09523809523809523;0.0;0.0;0.0;0.0
GG00BGGM1973_246;PARS GROU/PARTNERS B-N B-N GBP;Guernsey;0.0;0.0;1.0;0.09523809523809523;0.0;0.0;0.0;0.0
GG00BGGM1B92_246;PARS GROU/PARTNERS T-N T-N CHF;Guernsey;0.0;0.0;1.0;0.09523809523809523;0.0;0.0;0.0;0.0
GG00BGGM1C00_246;PARS GROU/PARTNERS T-N T-N USD;Guernsey;0.0;0.0;1.0;0.09523809523809523;0.0;0.0;0.0;0.0
GG00BGGM1F31_246;PARS GROU/PARTNERS N-N N-N USD;Guernsey;0.0;0.0;1.0;0.09523809523809523;0.0;0.0;0.0;0.0
GG00BLG33V10_246;The Part Fd/Ut Cl-GBP E GBP;Guernsey;0.0;0.0;1.0;0.09523809523809523;0.0;0.0;0.0;0.0
GG00BLG33W27_246;The Part Fd/Ut Cl-EUR E EUR;Guernsey;0.0;0.0;1.0;0.09523809523809523;0.0;0.0;0.0;0.0
GG00BLG33X34_246;PARS GROU/UT E USD ACC;Guernsey;0.0;0.0;1.0;0.09523809523809523;0.0;0.0;0.0;0.0
GG00BLG33Y41_246;PARS GROU/UT E CHF ACC;Guernsey;0.0;0.0;1.0;0.09523809523809523;0.0;0.0;0.0;0.0
GG00BMD24M63_246;PARS GROU/PARTNERS USD A-N AUD;Guernsey;0.0;0.0;1.0;0.09523809523809523;0.0;0.0;0.0;0.0
GG00BQB32251_246;PARS GROU/PARTNERS CAD- CAD-N ACC C;Guernsey;0.0;0.0;1.0;0.09523809523809523;0.0;0.0;0.0;0.0
GG00BSS86034_3129;M&G GUER/OFFSHORE GLOB INC GBP;Guernsey;0.0;0.0;0.0;0.0;0.0;0.0;0.0;0.0
GG00BSS86364_3129;M&G GUER/OFFSHORE UK S I GBP;Guernsey;0.0;0.0;0.0;0.0;0.0;0.0;0.0;0.0
GG00BWFGQ647_246;NTH TST/PARTNERS C CH CHF;Guernsey;0.0;0.0;1.0;0.09523809523809523;0.0;0.0;0.0;0.0
GG00BWFGQ753_246;NTH TST/PARTNERS C US USD;Guernsey;0.0;0.0;1.0;0.09523809523809523;0.0;0.0;0.0;0.0
IE0000829238_2913;BRNG INT/SHS CL-A USD;Ireland;0.0;0.0;0.0;0.2857142857142857;0.0;0.0;0.0;0.0
IE0000829451_18;BRNG INT/SHS CL-A USD;Ireland;0.0;0.0;0.0;0.2857142857142857;0.0;0.0;0.0;0.0
IE0000829568_14;BRNG INT/SHS CL-A USD;Ireland;1.0;1.0;0.0;0.23809523809523808;0.0;0.0;0.0;0.0
IE0000830236_17;BRNG INT/SHS CL-A USD;Ireland;0.0;0.0;0.0;0.2857142857142857;0.0;0.0;0.0;0.0
IE0000838304_14;BRNG EM/SHS CL-A USD;Ireland;0.0;0.0;0.0;0.2857142857142857;0.0;0.0;0.0;0.0
IE0000931182_2779;BRNG GB/SHS CL-A USD;Ireland;0.0;0.0;0.0;0.2857142857142857;0.0;0.0;0.0;0.0
IE0001534761_2785;G SACHS FD/SHS USD;Ireland;0.0;0.0;0.0;0.47619047619047616;0.16666666666666666;0.0;0.0;1.0
IE0002458671_2605;FINDLAY/SHS USD;Ireland;1.0;0.0;0.0;1.0;0.0;0.0;1.0;1.0
IE0003763251_2785;G SACHS FD/SHS USD;Ireland;0.0;0.0;0.0;0.47619047619047616;0.16666666666666666;0.0;0.0;1.0
IE0004314401_205;AXA ROS/UT CL-B USD;Ireland;1.0;1.0;0.0;0.6190476190476191;0.5;1.0;0.0;0.0
IE0004324657_3231;AXA ROS/UT CL-B USD;Ireland;1.0;1.0;0.0;0.6190476190476191;0.5;1.0;0.0;0.0
IE0004328963_3313;SHRT-TM INV/SHS GBP;Ireland;1.0;1.0;1.0;0.8095238095238095;0.0;0.5;1.0;1.0
IE0004329151_3313;SHRT-TM INV/SHS GBP;Ireland;1.0;1.0;1.0;0.8095238095238095;0.0;0.5;1.0;1.0
IE0004329268_3059;SHRT-TM INV/SHS USD;Ireland;1.0;1.0;1.0;0.8095238095238095;0.0;0.5;1.0;1.0
IE0004329375_3059;SHRT-TM INV/SHS CL-INSTL ACCUMG USD;Ireland;1.0;1.0;1.0;0.8095238095238095;0.0;0.5;1.0;1.0
IE0004329607_3059;SHRT-TM INV/SHS CL-CORP USD;Ireland;1.0;1.0;1.0;0.8095238095238095;0.0;0.5;1.0;1.0
IE0004334029_13;AXA ROS/UT CL-B USD;Ireland;1.0;1.0;0.0;0.6190476190476191;0.16666666666666666;1.0;0.0;0.0
IE0004345025_18;AXA ROS/UT CL-B USD;Ireland;1.0;1.0;0.0;0.6190476190476191;0.5;1.0;0.0;0.0
IE0004347849_431;MUZINICH/SHS CL-A USD;Ireland;1.0;0.0;0.0;1.0;0.0;0.0;1.0;1.0
IE0004354209_15;AXA ROS/UT CL-B JPY;Ireland;1.0;1.0;0.0;0.6190476190476191;0.16666666666666666;1.0;0.0;0.0
IE0004850503_205;BRNG EM/SHS CL-A EUR;Ireland;0.0;0.0;0.0;0.2857142857142857;0.0;0.0;0.0;0.0
IE0004851352_14;BRNG GB/SHS EUR;Ireland;0.0;0.0;0.0;0.2857142857142857;0.0;0.0;0.0;0.0
IE0004866665_18;BRNG INT/SHS CL-A EUR;Ireland;0.0;0.0;0.0;0.2857142857142857;0.0;0.0;0.0;0.0
IE0004866889_2913;BRNG INT/SHS CL-A EUR;Ireland;0.0;0.0;0.0;0.2857142857142857;0.0;0.0;0.0;0.0
IE0004866996_2605;BRNG INT/SHS CL-A EUR;Ireland;1.0;1.0;0.0;0.23809523809523808;0.0;0.0;0.0;0.0
IE0004868828_2779;BRNG INT/SHS CL-A EUR;Ireland;0.0;0.0;0.0;0.2857142857142857;0.0;0.0;0.0;0.0
IE0004904748_3059;SHRT-TM INV/SHS EUR;Ireland;1.0;1.0;1.0;0.8095238095238095;0.0;0.5;1.0;1.0
IE0005060367_2779;LAZ ACTIVE/SHS CL-RTL EUR;Ireland;0.0;0.0;0.0;0.2857142857142857;0.0;0.0;0.0;0.0
IE0005324847_354;MUZINICH/SHS CL-A EUR;Ireland;1.0;0.0;0.0;1.0;0.0;0.0;1.0;1.0
IE0008004719_3313;SHRT-TM INV/SHS GBP;Ireland;1.0;1.0;1.0;0.8095238095238095;0.0;0.5;1.0;1.0
IE0008005567_3059;SHRT-TM INV/SHS USD;Ireland;1.0;1.0;1.0;0.8095238095238095;0.0;0.5;1.0;1.0
IE0008040424_3059;SHRT-TM INV/SHS USD;Ireland;1.0;1.0;1.0;0.8095238095238095;0.0;0.5;1.0;1.0
IE0008042461_3059;SHRT-TM INV/SHS USD;Ireland;1.0;1.0;1.0;0.8095238095238095;0.0;0.5;1.0;1.0
IE0008365516_18;AXA ROS/UT CL-A USD;Ireland;1.0;1.0;0.0;0.6190476190476191;0.5;1.0;0.0;0.0
IE0008366589_2720;AXA ROS/UT CL-A JPY;Ireland;1.0;1.0;0.0;0.6190476190476191;0.16666666666666666;1.0;0.0;0.0
IE0008366704_2608;AXA ROS/UT CL-A USD;Ireland;1.0;1.0;0.0;0.6190476190476191;0.5;1.0;0.0;0.0
IE0008366928_2608;AXA ROS/UT CL-A USD;Ireland;1.0;1.0;0.0;0.6190476190476191;0.5;1.0;0.0;0.0
IE0008367009_9760;AXA ROS/UT CL-A USD;Ireland;1.0;1.0;0.0;0.6190476190476191;0.16666666666666666;1.0;0.0;0.0
IE0008553855_3231;DWS DGLS/SHS CL-PLATINUM USD;Ireland;0.0;0.0;0.0;0.047619047619047616;0.5;0.0;0.0;0.0
IE0008554044_3231;DWS DGLS/SHS CL-ADVISORY USD;Ireland;0.0;0.0;0.0;0.047619047619047616;0.5;0.0;0.0;0.0
IE0008554267_3231;DWS DGLS/SHS CL-INSTL USD;Ireland;0.0;0.0;0.0;0.047619047619047616;0.5;0.0;0.0;0.0
IE0008643037_3230;DWS DGLS/SHS CL-PLATINUM EUR;Ireland;0.0;0.0;0.0;0.047619047619047616;0.5;0.0;0.0;0.0
IE0008643250_3230;DWS DGLS/SHS CL-ADVISORY EUR;Ireland;0.0;0.0;0.0;0.047619047619047616;0.5;0.0;0.0;0.0
IE0008707428_2720;DWS DGLS/SHS CL-ADVISORY GBP;Ireland;0.0;0.0;0.0;0.047619047619047616;0.5;0.0;0.0;0.0
IE0008720272_3313;DWS DGLS/SHS CL-INSTL GBP;Ireland;0.0;0.0;0.0;0.047619047619047616;0.5;0.0;0.0;0.0
IE0009240692_3231;NATIXIS DUB/SHS CL-1 USD;Ireland;0.0;0.0;0.0;0.7619047619047619;0.0;0.0;0.0;0.0
IE0009407531_3313;G SACHS FD/SHS USD;Ireland;0.0;0.0;0.0;0.47619047619047616;0.16666666666666666;0.0;0.0;1.0
IT0000382561_354;BNL AZ ITA - FOCUS ITALIA;Italy;0.0;0.0;0.0;0.0;0.0;0.0;0.0;0.0
IT0000388204_282;AMUNDI OBBL ITALIA BT/OICVM NMON;Italy;1.0;0.0;0.0;1.0;0.0;0.0;1.0;1.0
IT0000388808_354;BNL AZIONI AMERICA OFBNPFU GRO;Italy;1.0;1.0;0.0;1.0;0.5;1.0;1.0;1.0
IT0000388840_282;BNL OBBLIGAZIONI EMERG OFDPB;Italy;1.0;1.0;0.0;1.0;0.3333333333333333;1.0;1.0;1.0
IT0001080404_282;SOLUZIONE ESG 10/OICVM NMON CLA EUR;Italy;0.0;0.0;0.0;0.047619047619047616;0.0;0.0;0.0;0.0
IT0001250205_282;AMUNDI OBBL BREVE TERMINE;Italy;1.0;1.0;0.0;1.0;0.3333333333333333;1.0;1.0;1.0
IT0001250239_282;AMUNDI OBBL BREVE TERMINE;Italy;1.0;1.0;0.0;1.0;0.3333333333333333;1.0;1.0;1.0
IT0001318739_282;AMUNDI OBBL PAESI EMERG A DIS;Italy;1.0;0.0;0.0;1.0;0.0;0.0;1.0;1.0
IT0001374245_354;BNL OBBLIGAZIONI GL OFDBNPP;Italy;1.0;1.0;0.0;1.0;0.5;1.0;1.0;1.0
IT0001374302_354;BNL AZIONI EMERGENTI-OFPE;Italy;1.0;1.0;0.0;1.0;0.5;1.0;1.0;1.0
IT0001468047_282;BNL AZIONI EUROPA DIV OFDPE;Italy;1.0;1.0;0.0;1.0;0.5;1.0;1.0;1.0
IT0004240542_282;BNP PARIBAS DIN - OFDBNP;Italy;1.0;1.0;0.0;1.0;0.5;1.0;1.0;1.0
IT0004253800_282;AMUNDI IMPEGNO ITALIA/OICVM NMON;Italy;1.0;0.0;0.0;1.0;0.3333333333333333;0.0;1.0;1.0
IT0004253826_282;AMUNDI IMPEGNO ITALIA/OICVM NMON;Italy;1.0;0.0;0.0;1.0;0.3333333333333333;0.0;1.0;1.0
IT0004791759_282;AMUNDI OBB SIS ITALIA A DISTR;Italy;1.0;0.0;0.0;1.0;0.3333333333333333;0.0;1.0;1.0
IT0004812449_282;AMUNDI OBBLIGAZION GLOBALE HY;Italy;1.0;1.0;0.0;1.0;0.3333333333333333;1.0;1.0;1.0
IT0004812464_282;AMUNDI OBBLIGAZION GLOBALE HY;Italy;1.0;1.0;0.0;1.0;0.3333333333333333;1.0;1.0;1.0
IT0004812514_282;AMUNDI OBBLIGAZ CORPORATE AM;Italy;1.0;1.0;0.0;1.0;0.3333333333333333;1.0;1.0;1.0
IT0004812530_282;AMUNDI OBBLIGAZ CORPORATE AM;Italy;1.0;1.0;0.0;1.0;0.3333333333333333;1.0;1.0;1.0
IT0004814064_282;AMUNDI OBBL ITALIA BT/OICVM NMON;Italy;1.0;0.0;0.0;1.0;0.0;0.0;1.0;1.0
IT0004814510_282;AMUNDI OBBL PAESI EMERG A DIS;Italy;1.0;0.0;0.0;1.0;0.0;0.0;1.0;1.0
IT0004814577_282;AMUNDI OBB SIS ITALIA A DISTR;Italy;1.0;0.0;0.0;1.0;0.3333333333333333;0.0;1.0;1.0
IT0004814643_282;AMUNDI TARGET CONTROLLO/OICVM NMON;Italy;1.0;0.0;0.0;1.0;0.3333333333333333;0.0;1.0;1.0
IT0005028680_282;AMUNDI OBBL BREVE TERMINE;Italy;1.0;1.0;0.0;1.0;0.3333333333333333;1.0;1.0;1.0
IT0005028698_282;AMUNDI OBBL BREVE TERMINE;Italy;1.0;1.0;0.0;1.0;0.3333333333333333;1.0;1.0;1.0
IT0005125049_282;AMUNDI ESG SELECTION BILANCIAT;Italy;1.0;1.0;0.0;1.0;0.3333333333333333;1.0;1.0;1.0
IT0005125064_282;AMUNDI ESG SELECTION CONSERVAT;Italy;1.0;1.0;0.0;1.0;0.3333333333333333;1.0;1.0;1.0
IT0005125080_282;AMUNDI ESG SELECTION DINAMICO;Italy;1.0;1.0;0.0;1.0;0.3333333333333333;1.0;1.0;1.0
IT0005189128_282;AMUNDI IMPEGNO ITALIA/OICVM NMON;Italy;1.0;0.0;0.0;1.0;0.3333333333333333;0.0;1.0;1.0
IT0005241440_282;AMUNDI VALORE ITALIA PIR;Italy;1.0;1.0;0.0;1.0;0.3333333333333333;1.0;1.0;1.0
IT0005241465_282;AMUNDI VALORE ITALIA PIR;Italy;1.0;1.0;0.0;1.0;0.3333333333333333;1.0;1.0;1.0
IT0005243263_282;AMUNDI OBBL BREVE TERMINE;Italy;1.0;1.0;0.0;1.0;0.3333333333333333;1.0;1.0;1.0
IT0005243289_282;AMUNDI IMPEGNO ITALIA/OICVM NMON;Italy;1.0;0.0;0.0;1.0;0.3333333333333333;0.0;1.0;1.0
IT0005250243_282;AMUNDI PRIMO INVESTIMENTO;Italy;1.0;1.0;0.0;1.0;0.3333333333333333;1.0;1.0;1.0
IT0005250268_282;AMUNDI PRIMO INVESTIMENTO;Italy;1.0;1.0;0.0;1.0;0.3333333333333333;1.0;1.0;1.0
IT0005250904_282;AMUNDI VALORE ITALIA PIR;Italy;1.0;1.0;0.0;1.0;0.3333333333333333;1.0;1.0;1.0
IT0005323131_282;AMUNDI PRIMO INVESTIMENTO;Italy;1.0;1.0;0.0;1.0;0.3333333333333333;1.0;1.0;1.0
IT0005340952_282;AMUNDI PRIVATE MEGATREND 2023;Italy;1.0;1.0;0.0;1.0;0.3333333333333333;0.0;1.0;1.0
IT0005351322_282;AMUNDI SELEZIONE BENESSERE 202;Italy;1.0;1.0;0.0;1.0;0.3333333333333333;0.0;1.0;1.0
IT0005351371_282;AMUNDI ACCUMULAZIONE DISRUPTIO;Italy;1.0;1.0;0.0;1.0;0.3333333333333333;0.0;1.0;1.0
IT0005358046_282;AMUNDI ACCUMULAZIONE MEGATREND;Italy;1.0;1.0;0.0;1.0;0.3333333333333333;0.0;1.0;1.0
IT0005358061_282;AMUNDI SELEZIONE BENESSERE 05/;Italy;1.0;1.0;0.0;1.0;0.3333333333333333;0.0;1.0;1.0
IT0005362832_282;AMUNDI PROTEZIONE 85/OICVM NMON EUR;Italy;1.0;1.0;0.0;1.0;0.0;0.0;1.0;1.0
IT0005371080_282;AMUNDI SELEZION BENESSERE 9/24;Italy;1.0;1.0;0.0;1.0;0.3333333333333333;0.0;1.0;1.0
IT0005371106_282;AMUNDI ACC MEGATREND 2024 DUE;Italy;1.0;1.0;0.0;1.0;0.3333333333333333;0.0;1.0;1.0
IT0005381865_282;AMUNDI SELEZIONE MILLENNIALS 2;Italy;1.0;1.0;0.0;1.0;0.3333333333333333;0.0;1.0;1.0
IT0005381907_282;AMUNDI PRIVATE SOSTENIBILE 202;Italy;1.0;1.0;0.0;1.0;0.3333333333333333;0.0;1.0;1.0
IT0005381923_282;AMUNDI ACCUMULAZIONE MERCATI E;Italy;1.0;1.0;0.0;1.0;0.3333333333333333;0.0;1.0;1.0
IT0005389793_282;AMUNDI ACCUMULAZIONE MERCATI E;Italy;1.0;1.0;0.0;1.0;0.3333333333333333;0.0;1.0;1.0
LI0010404585_351;H.A.M.Glb Cv BF/Ut Cl--EUR-A- EUR;Liechtenstein;0.0;0.0;0.0;0.0;0.0;0.0;0.0;0.0
LI0017502381_2810;ACATIS Fair Val/Ut Cl--EUR-P- EUR;Liechtenstein;1.0;1.0;1.0;1.0;0.0;1.0;1.0;1.0
LI0022353390_3313;KEOX Fd-ESG Bd/Ut Cl--EUR-R- EUR;Liechtenstein;0.0;0.0;0.0;0.0;0.0;0.0;0.0;0.0
LI0028897788_349;H.A.M.Glb Cv BF/Ut Cl--USD-A- USD;Liechtenstein;0.0;0.0;0.0;0.0;0.0;0.0;0.0;0.0
LI0037862872_511;ChmSusGlCnBFd/Ut Cl--EUR-P- EUR;Liechtenstein;0.0;0.0;0.0;0.0;0.0;0.0;0.0;0.0
LI0042307384_2810;TL Nachhaltigfd/Ut Cl--BRASCRI- CHF;Liechtenstein;0.0;0.0;0.0;0.0;0.0;0.0;0.0;0.0
LI0045967341_205;H.A.M.Glb Cv BF/Ut Cl--CHF-A- CHF;Liechtenstein;0.0;0.0;0.0;0.0;0.0;0.0;0.0;0.0
LI0047679860_3313;BonafideGlbFish/Ut Cl--CHF- CHF;Liechtenstein;1.0;0.0;0.0;0.5714285714285714;0.0;0.0;1.0;1.0
LI0123466802_15;ACATIS Fair Val/Ut Cl--CHF-P- CHF;Liechtenstein;1.0;1.0;1.0;1.0;0.0;1.0;1.0;1.0
LI0148578169_205;AQUIS-LuViFd/Ut Cl--USD-R- USD;Liechtenstein;0.0;0.0;0.0;0.0;0.0;0.0;0.0;0.0
LI0181468138_3313;BonafideGlbFish/Ut Cl--EUR- EUR;Liechtenstein;1.0;0.0;0.0;0.5714285714285714;0.0;0.0;1.0;1.0
LI0183680391_3313;Beagle Flag Fd/Ut EUR;Liechtenstein;0.0;0.0;0.0;0.0;0.0;0.0;0.0;0.0
LI0185254757_3313;KEOX Fd-ESG Bd/Ut Cl--CHF-R- CHF;Liechtenstein;0.0;0.0;0.0;0.0;0.0;0.0;0.0;0.0
LI0185254765_3313;KEOX Fd-ESG Bd/Ut Cl--USD-R- USD;Liechtenstein;0.0;0.0;0.0;0.0;0.0;0.0;0.0;0.0
LI0245942557_3313;TL Nachhaltigfd/Ut Cl--HILFSWERKE-;Liechtenstein;0.0;0.0;0.0;0.0;0.0;0.0;0.0;0.0
LI0252716753_3313;BonafideGlbFish/Ut Cl--USD- USD;Liechtenstein;1.0;0.0;0.0;0.5714285714285714;0.0;0.0;1.0;1.0
LI0253998061_3313;ACATIS Fair Val/Ut Cl--EUR-I- EUR;Liechtenstein;1.0;1.0;1.0;1.0;0.0;1.0;1.0;1.0
LI0253998095_200;ACATIS Fair Val/Ut Cl-USD-P USD;Liechtenstein;1.0;1.0;1.0;1.0;0.0;1.0;1.0;1.0
LI0292265704_393;ChmSusGlCnBFd/Ut Cl--CHF-P- CHF;Liechtenstein;0.0;0.0;0.0;0.0;0.0;0.0;0.0;0.0
LI0306626206_3313;ACATIS Fair Val/Ut Cl--CHF-I- CHF;Liechtenstein;1.0;1.0;1.0;1.0;0.0;1.0;1.0;1.0
LI0321177912_200;ACATIS Fair Val/Ut Cl-EUR-V EUR;Liechtenstein;1.0;1.0;1.0;1.0;0.0;1.0;1.0;1.0
LI0324221725_511;ChmSusGlCnBFd/Ut Cl--EUR-I- EUR;Liechtenstein;0.0;0.0;0.0;0.0;0.0;0.0;0.0;0.0
LI0324221808_393;ChmSusGlCnBFd/Ut Cl--CHF-I- CHF;Liechtenstein;0.0;0.0;0.0;0.0;0.0;0.0;0.0;0.0
LI0329781590_3313;BonafideGlbFish/Ut Cl--CHF-A- CHF;Liechtenstein;1.0;0.0;0.0;0.5714285714285714;0.0;0.0;1.0;1.0
LI0329781608_3313;BonafideGlbFish/Ut Cl--EUR-A- EUR;Liechtenstein;1.0;0.0;0.0;0.5714285714285714;0.0;0.0;1.0;1.0
LI0334507477_205;AQUIS-LuViFd/Ut Cl--CHF-R- CHF;Liechtenstein;0.0;0.0;0.0;0.0;0.0;0.0;0.0;0.0
LI0334507485_3313;AQUIS-LuViFd/Ut Cl--EUR-R- EUR;Liechtenstein;0.0;0.0;0.0;0.0;0.0;0.0;0.0;0.0
LI0335987173_3313;ACATIS Fair Val/Ut Cl--USD-K- USD;Liechtenstein;1.0;1.0;1.0;1.0;0.0;1.0;1.0;1.0
LI0336894352_3230;H.A.M.Glb Cv BF/Ut Cl--EUR-D- EUR;Liechtenstein;0.0;0.0;0.0;0.0;0.0;0.0;0.0;0.0
LI0336894360_3313;H.A.M.Glb Cv BF/Ut Cl--USD-D- USD;Liechtenstein;0.0;0.0;0.0;0.0;0.0;0.0;0.0;0.0
LI0336894378_2810;H.A.M.Glb Cv BF/Ut Cl--CHF-D- CHF;Liechtenstein;0.0;0.0;0.0;0.0;0.0;0.0;0.0;0.0
LI0339972288_3313;GlbMDbaSMEFd/Ut Cl--I- USD;Liechtenstein;0.0;0.0;0.0;0.0;0.0;0.0;0.0;0.0
LI0348132080_3313;CHEEqtyFd-Glob/Ut Cl--USD- USD;Liechtenstein;1.0;1.0;1.0;1.0;0.0;1.0;1.0;1.0
LI0348132148_3313;CHEEqtyFd-Glob/Ut Cl--CHF- CHF;Liechtenstein;1.0;1.0;1.0;1.0;0.0;1.0;1.0;1.0
LI0348132296_3313;CHEEqtyFd-Glob/Ut Cl--EUR- EUR;Liechtenstein;1.0;1.0;1.0;1.0;0.0;1.0;1.0;1.0
LI0351138891_3313;KEOX Fd-ESG Bd/Ut Cl--EUR-I- EUR;Liechtenstein;0.0;0.0;0.0;0.0;0.0;0.0;0.0;0.0
LI0351138917_3313;KEOX Fd-ESG Bd/Ut Cl--CHF-I- CHF;Liechtenstein;0.0;0.0;0.0;0.0;0.0;0.0;0.0;0.0
LI0351138925_3313;KEOX Fd-ESG Bd/Ut Cl--USD-I- USD;Liechtenstein;0.0;0.0;0.0;0.0;0.0;0.0;0.0;0.0
LI0364737259_2810;H.A.M.Glb Cv BF/Ut Cl--GBP-A- GBP;Liechtenstein;0.0;0.0;0.0;0.0;0.0;0.0;0.0;0.0
LI0394750827_2810;SwLiGSF-iConOr/Ut Cl--EUR- EUR;Liechtenstein;0.0;0.0;0.0;0.0;0.0;0.0;0.0;0.0
LI0394750835_3233;SwLiGSF-iConOr/Ut Cl--CHF- CHF;Liechtenstein;0.0;0.0;0.0;0.0;0.0;0.0;0.0;0.0
LI0394750843_3230;SwLiGSF-iDynTi/Ut Cl--EUR- EUR;Liechtenstein;0.0;0.0;0.0;0.0;0.0;0.0;0.0;0.0
LI0394750850_2810;SwLiGSF-iDynTi/Ut Cl--CHF- CHF;Liechtenstein;0.0;0.0;0.0;0.0;0.0;0.0;0.0;0.0
LI0408681091_3313;AQUIS-LuViFd/Ut Cl--USD-I- USD;Liechtenstein;0.0;0.0;0.0;0.0;0.0;0.0;0.0;0.0
LI0408681109_2810;AQUIS-LuViFd/Ut Cl--USD-I2- USD;Liechtenstein;0.0;0.0;0.0;0.0;0.0;0.0;0.0;0.0
LI0408681117_3313;AQUIS-LuViFd/Ut Cl--CHF-I- CHF;Liechtenstein;0.0;0.0;0.0;0.0;0.0;0.0;0.0;0.0
LI0408681125_2810;AQUIS-LuViFd/Ut Cl--CHF-I2- CHF;Liechtenstein;0.0;0.0;0.0;0.0;0.0;0.0;0.0;0.0
LI0459812520_2810;BoInvFd-BeCat I/Ut Cl--EUR- EUR;Liechtenstein;1.0;0.0;0.0;0.5714285714285714;0.0;0.0;1.0;1.0
LI0466183220_2810;NEMO Fund/Ut Cl-EUR EUR;Liechtenstein;0.0;0.0;0.0;0.0;0.0;0.0;0.0;0.0
LI0466188294_3235;NEMO Fund/Ut Cl--CZK- CZK;Liechtenstein;0.0;0.0;0.0;0.0;0.0;0.0;0.0;0.0
LU0012006317_354;TREETOP CONV.SICAV/EUR;Luxembourg;0.0;0.0;0.0;0.0;0.0;0.0;0.0;0.0
LU0028445327_354;EDM INTERN/EUR;Luxembourg;1.0;0.0;0.0;0.7142857142857143;0.0;0.0;1.0;1.0
LU0028445590_354;EDM INTERN/EUR;Luxembourg;1.0;0.0;0.0;0.8095238095238095;0.0;0.0;1.0;1.0
LU0034955152_431;AB SIC.I-SUS GLO/USD;Luxembourg;1.0;0.0;0.0;1.0;0.3333333333333333;0.0;1.0;1.0
LU0034955236_431;AB I Sus Gl Th/Sh Cl-BXX USD;Luxembourg;1.0;0.0;0.0;1.0;0.3333333333333333;0.0;1.0;1.0
LU0040769829_431;GS FDS-GL.EQ/SH USD;Luxembourg;1.0;0.0;0.0;0.47619047619047616;0.16666666666666666;0.0;0.0;0.0
LU0044957727_2779;AB FCP I-AMER.INC.A/SH USD;Luxembourg;0.0;0.0;0.0;0.0;0.0;0.0;0.0;0.0
LU0044957990_431;AB I Am Inc/Ut Cl-B USD;Luxembourg;0.0;0.0;0.0;0.0;0.0;0.0;0.0;0.0
LU0044958022_431;AB FCP I-AMER.INC.C/USD;Luxembourg;0.0;0.0;0.0;0.0;0.0;0.0;0.0;0.0
LU0047987325_2779;AB SIC.I-INDIA GR.A/SH USD;Luxembourg;0.0;0.0;0.0;0.0;0.0;0.0;0.0;0.0
LU0048215999_431;AB I India Gr/Sh Cl-BX USD;Luxembourg;0.0;0.0;0.0;0.0;0.0;0.0;0.0;0.0
LU0048388663_13;SCHRODER ISF-ASIAN/SH USD;Luxembourg;1.0;0.0;0.0;1.0;0.16666666666666666;0.0;1.0;1.0
LU0048423833_2779;PRO FONDS (LUX)/SH EUR;Luxembourg;1.0;0.0;0.0;1.0;0.5;0.0;1.0;1.0
LU0048423916_611;PRO FONDS (LUX)/CHF;Luxembourg;1.0;0.0;0.0;1.0;0.5;0.0;1.0;1.0
LU0048424138_17;PRO FONDS (LUX)/SH CHF;Luxembourg;1.0;0.0;0.0;1.0;0.5;0.0;1.0;1.0
LU0049853897_16;SCHRODER/SH USD;Luxembourg;1.0;0.0;0.0;1.0;0.16666666666666666;0.0;1.0;1.0
LU0049910796_354;BIL INVEST/EUR;Luxembourg;1.0;1.0;1.0;0.8571428571428571;0.0;0.5;1.0;1.0
LU0049911091_430;BIL INVEST/EUR;Luxembourg;1.0;1.0;1.0;0.8571428571428571;0.0;0.5;1.0;1.0
LU0049911844_354;BIL INVEST/EUR;Luxembourg;1.0;1.0;1.0;0.8571428571428571;0.0;0.5;1.0;1.0
LU0049912065_354;BIL INVEST/EUR;Luxembourg;1.0;1.0;1.0;0.8571428571428571;0.0;0.5;1.0;1.0
LU0050126431_431;GS FDS-ASIA EQ/SH USD;Luxembourg;1.0;0.0;0.0;0.47619047619047616;0.16666666666666666;0.0;0.0;0.0
LU0050692549_431;AB FCP I-MORTG.INC/USD;Luxembourg;0.0;0.0;0.0;0.0;0.0;0.0;0.0;0.0
LU0050693513_431;AB I Mort Inc/Ut Cl-BX USD;Luxembourg;0.0;0.0;0.0;0.0;0.0;0.0;0.0;0.0
LU0050693943_431;AB FCP I-MORTG.INC/USD;Luxembourg;0.0;0.0;0.0;0.0;0.0;0.0;0.0;0.0
LU0051128774_431;GOLD.SACHS EM MK.EN/SH USD;Luxembourg;1.0;0.0;0.0;0.14285714285714285;0.5;0.0;0.0;0.0
LU0051128931_431;GOLD.SACHS EM MK.EN/SH USD;Luxembourg;1.0;0.0;0.0;0.14285714285714285;0.5;0.0;0.0;0.0
LU0051129079_431;GOLDMAN SACHS-AS/USD;Luxembourg;0.0;0.0;0.0;0.0;0.0;0.0;0.0;0.0
LU0051129152_431;GOLDMAN SACHS-AS/USD;Luxembourg;0.0;0.0;0.0;0.0;0.0;0.0;0.0;0.0
LU0052864419_431;INVESCO FDS-INV.GLO/SH USD;Luxembourg;1.0;1.0;1.0;1.0;0.0;1.0;1.0;1.0
LU0053671581_2913;JPMORGAN-US SMALL/SH USD;Luxembourg;0.0;0.0;0.0;0.0;0.16666666666666666;0.0;0.0;0.0
LU0053685615_18;JPMORGAN-EMERGING/SH USD;Luxembourg;0.0;0.0;0.0;0.0;0.16666666666666666;0.0;0.0;0.0
LU0054300461_246;LEMANIK-ASIAN OPPOR/EUR;Luxembourg;0.0;0.0;0.0;0.0;0.0;0.0;0.0;0.0
LU0054403190_431;AB SICAV I-AMER.GR./USD;Luxembourg;0.0;0.0;0.0;0.0;0.0;0.0;0.0;0.0
LU0054548911_431;AB FCP I-AMER.INC.C/USD;Luxembourg;0.0;0.0;0.0;0.0;0.0;0.0;0.0;0.0
LU0054846695_431;AB FCP I-EM.M.GR.C/USD;Luxembourg;0.0;0.0;0.0;0.0;0.0;0.0;0.0;0.0
LU0056052961_16;CANDRIAM EQUITIES L/SH EUR;Luxembourg;1.0;0.0;0.0;0.8095238095238095;0.5;0.0;0.0;0.0
LU0056053001_16;CANDRIAM EQUITIES/SH EUR;Luxembourg;1.0;0.0;0.0;0.8095238095238095;0.5;0.0;0.0;0.0
LU0057025933_16;AB SIC.I-SUS GLO/SH USD;Luxembourg;1.0;0.0;0.0;1.0;0.3333333333333333;0.0;1.0;1.0
LU0057026071_431;AB I Sus Gl Th/Sh Cl-BX USD;Luxembourg;1.0;0.0;0.0;1.0;0.3333333333333333;0.0;1.0;1.0
LU0058720904_15;AB SIC.I-INT.HEALTH/SH USD;Luxembourg;0.0;0.0;0.0;0.0;0.0;0.0;0.0;0.0
LU0058721035_431;AB I Intl HC/Sh Cl-B USD;Luxembourg;0.0;0.0;0.0;0.0;0.0;0.0;0.0;0.0
LU0060230025_2913;AB SIC.I-INT.TECH.A/SH USD;Luxembourg;0.0;0.0;0.0;0.0;0.0;0.0;0.0;0.0
LU0061928585_2913;OEKOWORLD-OEKOVISIO/SH EUR;Luxembourg;1.0;0.0;1.0;1.0;0.3333333333333333;0.0;1.0;1.0
LU0062903967_431;SCHRODER/USD;Luxembourg;1.0;0.0;0.0;1.0;0.16666666666666666;0.0;1.0;1.0
LU0062906986_431;SCHRODER ISF-ASIAN/USD;Luxembourg;1.0;0.0;0.0;1.0;0.16666666666666666;0.0;1.0;1.0
LU0067059799_2913;DNB FUND-ASIAN MID/SH EUR;Luxembourg;0.0;0.0;0.0;0.0;0.0;0.0;0.0;0.0
LU0077500055_18;CANDRIAM BONDS-EURO/SH EUR;Luxembourg;1.0;0.0;0.0;0.8095238095238095;0.5;1.0;0.0;0.0
LU0094967261_708;GOLDMAN SACHS-CZECH/CZK;Luxembourg;0.0;0.0;0.0;0.0;0.0;0.0;0.0;0.0
LU0094967691_3235;GOLDMAN SACHS-CZ.CR/CZK;Luxembourg;0.0;0.0;0.0;0.0;0.0;0.0;0.0;0.0
LU0095053426_2913;PICTET-JAPANESE EQ./SH JPY;Luxembourg;1.0;1.0;0.0;1.0;0.0;1.0;1.0;1.0
NL0000215366_2732;Belfds. Zonnewi/Sh NLG;Netherlands;0.0;0.0;0.0;0.0;0.0;0.0;0.0;0.0
NL0000286441_3313;Goldman Sachs F/Sh EUR;Netherlands;1.0;0.0;0.0;0.047619047619047616;0.0;1.0;0.0;0.0
